{
  "schema_version": "remote-destination-audit@1",
  "source": {
    "path": "/absolute/frozen/source.pdf",
    "sha256": "0000000000000000000000000000000000000000000000000000000000000000"
  },
  "target": {
    "path": "/absolute/output/candidate.pdf",
    "sha256": "0000000000000000000000000000000000000000000000000000000000000000"
  },
  "bindings": [
    {
      "id": "source-link-p1-xref11",
      "source_page": 1,
      "source_xref": 11,
      "target_page": 1,
      "target_xref": 21
    }
  ],
  "dependencies": {
    "original.full.pdf": {
      "path": "/absolute/frozen/source.pdf",
      "sha256": "0000000000000000000000000000000000000000000000000000000000000000"
    }
  },
  "policy": {
    "id": "frozen-remote-xyz-dependency-v1",
    "maximum_pages": 20,
    "maximum_annotations": 1000,
    "coordinate_tolerance_pt": 0.001,
    "zoom_zero_equals_null": true,
    "case_overrides_allowed": false
  }
}
